{
  "schemaVersion": 1,
  "catalogId": "daoewo-v1",
  "version": 1,
  "chunkSize": 200,
  "decks": [
    {
      "id": "english-essential-intro",
      "title": "영어 필수단어 입문",
      "description": "일상과 실무에서 자주 만나는 영어 필수 어휘 입문 덱",
      "category": "language",
      "locale": "ko-KR",
      "contentLanguage": "en",
      "tier": "free",
      "priority": "P1",
      "contentStrategy": "vocab-swipe-import",
      "source": {
        "kind": "repository-snapshot",
        "name": "seorilabs/vocab-swipe TOEIC Service List 변환 자산",
        "uri": "https://github.com/seorilabs/vocab-swipe",
        "external": true,
        "commit": "e1ba2d5503d1f90ee9d6995c80070b0e2e3152e6",
        "revision": "nltk-data-hub/words@toeic+tsl-definitions+wordnet-3.0-top-300"
      },
      "license": {
        "policy": "mixed",
        "components": [
          {
            "id": "CC-BY-SA-4.0",
            "attribution": "TOEIC Service List 1.2, Browne and Culligan; nltk-data-hub/words",
            "evidenceUri": "https://huggingface.co/datasets/nltk-data-hub/words",
            "commercialUse": true,
            "shareAlike": true
          },
          {
            "id": "WordNet-3.0",
            "attribution": "Princeton University WordNet 3.0",
            "evidenceUri": "https://wordnet.princeton.edu/license-and-commercial-use",
            "commercialUse": true,
            "shareAlike": false
          },
          {
            "id": "LicenseRef-Seorilabs-Self-Authored",
            "attribution": "Seorilabs 자체 작성 한국어 뜻·예문 보강",
            "evidenceUri": "urn:daoewo:content-policy:v1",
            "commercialUse": true,
            "shareAlike": false
          }
        ],
        "distributionNotice": "CC BY-SA 4.0 출처·변경 고지와 동일조건 공유를 배포물에 유지한다. ETS 공식 문항·예문·음원은 포함하지 않는다."
      },
      "provenance": {
        "kind": "planned",
        "recipe": "vocab-swipe TOEIC 행 중 입문 범위를 선별하고 자체 예문·한국어 뜻을 보강한다.",
        "inputDigest": null,
        "generatedBy": "operator-cli"
      },
      "reviewer": { "status": "pending", "name": null, "reviewedAt": null, "evidence": null },
      "status": "planned",
      "version": 1,
      "chunkSize": 200,
      "tags": ["영어", "입문", "필수어휘"]
    },
    {
      "id": "english-toeic-advanced",
      "title": "영어 심화(TOEIC 빈출)",
      "description": "업무 영어와 TOEIC 대비에 자주 쓰이는 심화 어휘 덱",
      "category": "language",
      "locale": "ko-KR",
      "contentLanguage": "en",
      "tier": "pro",
      "priority": "P1",
      "contentStrategy": "vocab-swipe-import",
      "source": {
        "kind": "repository-snapshot",
        "name": "seorilabs/vocab-swipe TOEIC Service List 변환 자산",
        "uri": "https://github.com/seorilabs/vocab-swipe",
        "external": true,
        "commit": "e1ba2d5503d1f90ee9d6995c80070b0e2e3152e6",
        "revision": "nltk-data-hub/words@toeic+tsl-definitions+wordnet-3.0-top-300"
      },
      "license": {
        "policy": "mixed",
        "components": [
          {
            "id": "CC-BY-SA-4.0",
            "attribution": "TOEIC Service List 1.2, Browne and Culligan; nltk-data-hub/words",
            "evidenceUri": "https://huggingface.co/datasets/nltk-data-hub/words",
            "commercialUse": true,
            "shareAlike": true
          },
          {
            "id": "WordNet-3.0",
            "attribution": "Princeton University WordNet 3.0",
            "evidenceUri": "https://wordnet.princeton.edu/license-and-commercial-use",
            "commercialUse": true,
            "shareAlike": false
          },
          {
            "id": "LicenseRef-Seorilabs-Self-Authored",
            "attribution": "Seorilabs 자체 작성 한국어 뜻·예문 보강",
            "evidenceUri": "urn:daoewo:content-policy:v1",
            "commercialUse": true,
            "shareAlike": false
          }
        ],
        "distributionNotice": "CC BY-SA 4.0 출처·변경 고지와 동일조건 공유를 배포물에 유지한다. TOEIC 공식 제휴로 오인시키지 않고 ETS 공식 문항·예문·음원은 포함하지 않는다."
      },
      "provenance": {
        "kind": "planned",
        "recipe": "vocab-swipe TOEIC 전체 목록을 가져와 심화 범위와 자체 보강을 정규화한다.",
        "inputDigest": null,
        "generatedBy": "operator-cli"
      },
      "reviewer": { "status": "pending", "name": null, "reviewedAt": null, "evidence": null },
      "status": "planned",
      "version": 1,
      "chunkSize": 200,
      "tags": ["영어", "TOEIC", "심화"]
    },
    {
      "id": "japanese-jlpt-n5-preview",
      "title": "일본어 JLPT N5 맛보기",
      "description": "일본어 입문자가 먼저 익힐 N5 수준 핵심 어휘 맛보기 덱",
      "category": "language",
      "locale": "ko-KR",
      "contentLanguage": "ja",
      "tier": "free",
      "priority": "P1",
      "contentStrategy": "vocab-swipe-import",
      "source": {
        "kind": "repository-snapshot",
        "name": "seorilabs/vocab-swipe JLPT 변환 자산",
        "uri": "https://github.com/seorilabs/vocab-swipe",
        "external": true,
        "commit": "e1ba2d5503d1f90ee9d6995c80070b0e2e3152e6",
        "revision": "elzup/jlpt-word-list@master captured by pinned vocab-swipe commit"
      },
      "license": {
        "policy": "mixed",
        "components": [
          {
            "id": "MIT",
            "attribution": "elzup/jlpt-word-list",
            "evidenceUri": "https://github.com/elzup/jlpt-word-list",
            "commercialUse": true,
            "shareAlike": false
          },
          {
            "id": "LicenseRef-Seorilabs-Self-Authored",
            "attribution": "Seorilabs 자체 생성 한국어 뜻·예문·학습 팁",
            "evidenceUri": "urn:daoewo:content-policy:v1",
            "commercialUse": true,
            "shareAlike": false
          }
        ],
        "distributionNotice": "MIT 고지와 원저작권 고지를 유지한다. 공식 JLPT 출제 목록 또는 공식 제휴로 표시하지 않는다."
      },
      "provenance": {
        "kind": "planned",
        "recipe": "vocab-swipe N5 표제어와 자체 생성 보강의 교집합을 가져와 검수한다.",
        "inputDigest": null,
        "generatedBy": "operator-cli"
      },
      "reviewer": { "status": "pending", "name": null, "reviewedAt": null, "evidence": null },
      "status": "planned",
      "version": 1,
      "chunkSize": 200,
      "tags": ["일본어", "JLPT", "N5", "입문"]
    },
    {
      "id": "japanese-jlpt-n3-n2",
      "title": "일본어 JLPT N3~N2",
      "description": "중급 이상 일본어 학습자를 위한 N3~N2 수준 어휘 덱",
      "category": "language",
      "locale": "ko-KR",
      "contentLanguage": "ja",
      "tier": "pro",
      "priority": "P1",
      "contentStrategy": "vocab-swipe-import",
      "source": {
        "kind": "repository-snapshot",
        "name": "seorilabs/vocab-swipe JLPT 변환 자산",
        "uri": "https://github.com/seorilabs/vocab-swipe",
        "external": true,
        "commit": "e1ba2d5503d1f90ee9d6995c80070b0e2e3152e6",
        "revision": "elzup/jlpt-word-list@master captured by pinned vocab-swipe commit"
      },
      "license": {
        "policy": "mixed",
        "components": [
          {
            "id": "MIT",
            "attribution": "elzup/jlpt-word-list",
            "evidenceUri": "https://github.com/elzup/jlpt-word-list",
            "commercialUse": true,
            "shareAlike": false
          },
          {
            "id": "LicenseRef-Seorilabs-Self-Authored",
            "attribution": "Seorilabs 자체 생성 한국어 뜻·예문·학습 팁",
            "evidenceUri": "urn:daoewo:content-policy:v1",
            "commercialUse": true,
            "shareAlike": false
          }
        ],
        "distributionNotice": "MIT 고지와 원저작권 고지를 유지한다. 공식 JLPT 출제 목록 또는 공식 제휴로 표시하지 않는다."
      },
      "provenance": {
        "kind": "planned",
        "recipe": "vocab-swipe N3/N2 표제어와 자체 생성 보강의 교집합을 가져와 검수한다.",
        "inputDigest": null,
        "generatedBy": "operator-cli"
      },
      "reviewer": { "status": "pending", "name": null, "reviewedAt": null, "evidence": null },
      "status": "planned",
      "version": 1,
      "chunkSize": 200,
      "tags": ["일본어", "JLPT", "N3", "N2"]
    },
    {
      "id": "korean-vocabulary",
      "title": "한국어 어휘(국어)",
      "description": "국립국어원 한국어기초사전 텍스트를 바탕으로 한 한국어 어휘 덱",
      "category": "language",
      "locale": "ko-KR",
      "contentLanguage": "ko",
      "tier": "free",
      "priority": "P2",
      "contentStrategy": "vocab-swipe-import",
      "source": {
        "kind": "repository-snapshot",
        "name": "seorilabs/vocab-swipe 한국어기초사전 변환 자산",
        "uri": "https://github.com/seorilabs/vocab-swipe",
        "external": true,
        "commit": "e1ba2d5503d1f90ee9d6995c80070b0e2e3152e6",
        "revision": "krdict-download:level1@2026-05-29"
      },
      "license": {
        "policy": "single",
        "components": [
          {
            "id": "CC-BY-SA",
            "attribution": "국립국어원 한국어기초사전",
            "evidenceUri": "https://krdict.korean.go.kr",
            "commercialUse": true,
            "shareAlike": true
          }
        ],
        "distributionNotice": "한국어기초사전 텍스트의 출처·변경 고지와 동일조건 공유를 유지한다. 이미지·음성은 별도 권리 확인 전 가져오지 않는다."
      },
      "provenance": {
        "kind": "planned",
        "recipe": "vocab-swipe 한국어기초사전 generated 자산을 Card 스키마로 변환한다.",
        "inputDigest": null,
        "generatedBy": "operator-cli"
      },
      "reviewer": { "status": "pending", "name": null, "reviewedAt": null, "evidence": null },
      "status": "planned",
      "version": 1,
      "chunkSize": 200,
      "tags": ["한국어", "국어", "어휘"]
    },
    {
      "id": "korean-history-cert-core",
      "title": "한국사능력검정 핵심",
      "description": "한국사능력검정시험 학습에 필요한 시대별 핵심 사실 덱",
      "category": "certification",
      "locale": "ko-KR",
      "contentLanguage": "ko",
      "tier": "pro",
      "priority": "P1",
      "contentStrategy": "ai-assisted-operator-batch",
      "source": {
        "kind": "operator-topic-brief",
        "name": "다외워 한국사 핵심 기획 브리프",
        "uri": "urn:daoewo:brief:korean-history-cert-core:v1",
        "external": false,
        "commit": null,
        "revision": "brief-v1@2026-07-12"
      },
      "license": {
        "policy": "single",
        "components": [
          {